{
  "$schema": "https://json-schema.org/draft/2020-12/schema",
  "$id": "story-auto-media-plan/1.0.0",
  "type": "object",
  "additionalProperties": false,
  "required": [
    "schema_version",
    "project_id",
    "render_mode",
    "shot_plan_sha256",
    "shots"
  ],
  "properties": {
    "schema_version": {
      "const": "story-auto-media-plan/1.0.0"
    },
    "project_id": {
      "type": "string",
      "minLength": 3
    },
    "render_mode": {
      "enum": [
        "hybrid_hook",
        "full_video_ai",
        "ambient_story"
      ]
    },
    "shot_plan_sha256": {
      "type": "string"
    },
    "shots": {
      "type": "array",
      "minItems": 1,
      "items": {
        "type": "object"
      }
    },
    "hook_target_seconds": {
      "type": "number"
    },
    "resolved_hook_end": {
      "type": ["number", "null"]
    },
    "review_status": {
      "type": "string"
    },
    "technical_reuse": {
      "type": "object"
    }
  }
}
